{
  "$schema": "https://json-schema.org/draft/2020-12/schema",
  "$id": "https://graphcaster.local/schemas/graph-document.schema.json",
  "title": "GraphCaster graph document (v1.14)",
  "type": "object",
  "additionalProperties": true,
  "required": ["schemaVersion", "nodes", "edges"],
  "properties": {
    "schemaVersion": {
      "type": "integer",
      "minimum": 1
    },
    "meta": {
      "type": "object",
      "additionalProperties": true,
      "properties": {
        "schemaVersion": { "type": "integer" },
        "graphId": { "type": "string", "minLength": 1 },
        "title": { "type": "string" },
        "author": { "type": "string" }
      }
    },
    "viewport": {
      "type": "object",
      "additionalProperties": true,
      "properties": {
        "x": { "type": "number" },
        "y": { "type": "number" },
        "zoom": { "type": "number" }
      }
    },
    "nodes": {
      "type": "array",
      "items": { "$ref": "#/$defs/node" }
    },
    "edges": {
      "type": "array",
      "items": { "$ref": "#/$defs/edge" }
    }
  },
  "$defs": {
    "gcPin": {
      "type": "object",
      "additionalProperties": true,
      "description": "Pinned task output (optional). When enabled and payload contains a dict processResult, the runner may skip spawning the process and use that result; otherwise payload seeds node_outputs before the visit merge.",
      "properties": {
        "enabled": { "type": "boolean" },
        "payload": {
          "type": "object",
          "additionalProperties": true,
          "description": "Merged into node_outputs[nodeId] before the step if context does not already define that id. Use shape compatible with run output, e.g. { \"processResult\": { \"success\": true, \"exitCode\": 0 } }."
        }
      }
    },
    "envKeysList": {
      "type": "array",
      "items": {
        "type": "string",
        "pattern": "^[A-Za-z_][A-Za-z0-9_]*$"
      },
      "uniqueItems": true,
      "description": "Task-only: names of environment variables injected for the subprocess from <workspaceRoot>/.graphcaster/workspace.secrets.env when not set in task data.env (F8 v1)."
    },
    "gcCursorAgent": {
      "type": "object",
      "additionalProperties": true,
      "description": "Cursor Agent CLI preset for task nodes (phase 9). Builds argv for headless `agent -p` style runs; executable from GC_CURSOR_AGENT, PATH `agent`, or Windows %LOCALAPPDATA%\\\\cursor-agent\\\\agent.cmd. Do not store API keys in the graph — use host environment.",
      "properties": {
        "presetVersion": { "type": "integer", "const": 1 },
        "prompt": { "type": "string", "description": "Inline prompt text; optional if promptFile is set. Supports placeholders {{out:<nodeId>.processResult.stdout}} and .stderr (truncated)." },
        "promptFile": { "type": "string", "description": "Relative path from cwd base (no ..); read as UTF-8 when prompt is empty." },
        "cwdBase": {
          "type": "string",
          "enum": ["workspace_root", "graphs_root", "artifact_dir"],
          "default": "workspace_root",
          "description": "workspace_root: parent of graphs/ if folder is named graphs, else graphs root; graphs_root: workspace graphs directory; artifact_dir: root run artifact directory."
        },
        "cwdRelative": { "type": "string", "description": "Optional subdirectory under cwdBase (no ..)." },
        "printMode": { "type": "boolean", "default": true, "description": "When true, pass -p (--print) for headless output." },
        "applyFileChanges": { "type": "boolean", "default": false, "description": "When true with printMode, pass --force so the agent may modify files." },
        "model": { "type": "string", "description": "Optional --model argument." },
        "outputFormat": { "type": "string", "description": "Optional --output-format (e.g. text, json, stream-json)." },
        "extraArgs": {
          "type": "array",
          "items": { "type": "string" },
          "description": "Extra argv tokens inserted before the final prompt positional argument."
        }
      }
    },
    "node": {
      "type": "object",
      "additionalProperties": false,
      "required": ["id", "type", "position", "data"],
      "properties": {
        "id": { "type": "string", "minLength": 1 },
        "type": {
          "type": "string",
          "minLength": 1,
          "description": "Known kinds: start, exit, task, graph_ref, mcp_tool (external MCP tools/call per visit), llm_agent (delegated subprocess; stdin JSON + stdout NDJSON agent protocol), agent (in-runner tool loop; data.inputText and optional systemPrompt), ai_route (structured AI branch picker after upstream output), comment (sticky frame), group (organizational frame; n8n-style), merge (join; data.mode passthrough | barrier), fork (fan-out; unconditional out_default edges only in runner; optional data.maxParallel int >=1 caps parallel branch pool with runner/env/CLI), trigger_webhook (HTTP entry; no incoming edges; path + method + optional auth for run broker), trigger_schedule (cron metadata entry; no incoming edges; external scheduler), code (F67: sandboxed Python/JS snippet; result/stdout/stderr outputs; see $defs.codeData). Other values: unknown executable (task-like handles in validation)."
        },
        "position": {
          "type": "object",
          "required": ["x", "y"],
          "properties": {
            "x": { "type": "number" },
            "y": { "type": "number" }
          },
          "additionalProperties": true
        },
        "data": {
          "type": "object",
          "additionalProperties": true,
          "description": "Node settings. Task nodes may include gcPin (see $defs.gcPin): n8n-style pinned output / pinData for dev reruns; runner merges payload into node_outputs unless that id is already set in --context-json. Task nodes may set stepCache: true to opt into cross-run disk step cache (F17) when the host passes --step-cache and --artifacts-base. Task nodes may set envKeys ($defs.envKeysList) for workspace secrets (F8). Task nodes may set gcCursorAgent ($defs.gcCursorAgent) to run Cursor Agent CLI without hand-authored argv (command/argv still take precedence when set)."
        },
        "parentId": {
          "type": "string",
          "minLength": 1,
          "description": "Optional id of a comment or group frame this node belongs to (editor-only grouping)."
        }
      }
    },
    "llmAgentNodeData": {
      "type": "object",
      "additionalProperties": true,
      "description": "Delegated LLM / agent subprocess (F11): one JSON line on stdin (upstreamOutputs, optional inputPayload); child stdout must be NDJSON with types agent_delegate_start, agent_step, agent_tool_call, agent_finished, agent_failed. Uses same env/envKeys/CWD patterns as task (F8 secrets). Optional stepCache: true opts into cross-run disk step-cache (F17) when the host passes step-cache and artifacts-base (same contract as task / mcp_tool).",
      "properties": {
        "title": { "type": "string" },
        "stepCache": { "type": "boolean", "description": "When true, allow F17 step-cache for this node if the run host enables it." },
        "command": { "type": ["string", "array"] },
        "argv": { "type": "array", "items": { "type": "string" } },
        "cwd": { "type": "string" },
        "env": { "type": "object", "additionalProperties": { "type": "string" } },
        "envKeys": { "$ref": "#/$defs/envKeysList" },
        "timeoutSec": { "type": "number", "minimum": 1, "maximum": 86400, "default": 600 },
        "retryCount": { "type": "integer", "minimum": 0, "default": 0, "description": "Extra attempts after the first subprocess (same as task); emits process_retry between attempts." },
        "maxRetries": { "type": "integer", "minimum": 0, "description": "If set, combined with retryCount as max(retryCount, maxRetries) for total retries after first attempt." },
        "retryBackoffSec": { "type": "number", "minimum": 0, "default": 1, "description": "Delay before each retry (seconds)." },
        "maxAgentSteps": { "type": "integer", "minimum": 0, "default": 0, "description": "Max agent_step lines before runner kills child; 0 = unlimited." },
        "inputPayload": {
          "description": "Optional extra JSON merged into stdin payload as inputPayload (object or string)."
        }
      }
    },
    "edgeData": {
      "type": "object",
      "additionalProperties": true,
      "description": "Per-edge metadata. F18 port-kind overrides must use camelCase keys sourcePortKind and targetPortKind; snake_case aliases are not read by the runner or UI. Export from the canvas (fromReactFlow) persists routeDescription and validated port-kind keys only—other keys may be dropped after an edit/save roundtrip.",
      "properties": {
        "routeDescription": {
          "type": "string",
          "maxLength": 1024,
          "description": "Human-readable branch label for ai_route outgoing edges (sent to routing provider)."
        },
        "sourcePortKind": {
          "type": "string",
          "enum": ["any", "json", "primitive"],
          "description": "Optional F18 phase 2: camelCase only; override effective PortDataKind on the source side of this edge; if omitted, registry uses node.type + sourceHandle (see port_data_kinds.py / portDataKinds.ts)."
        },
        "targetPortKind": {
          "type": "string",
          "enum": ["any", "json", "primitive"],
          "description": "Optional F18 phase 2: camelCase only; override effective PortDataKind on the target side of this edge; if omitted, registry uses node.type + targetHandle."
        }
      }
    },
    "mcpToolNodeData": {
      "type": "object",
      "additionalProperties": true,
      "description": "MCP client node (direction B): one tools/call per visit. Secrets via envKeys / bearerEnvKey + workspace secrets (F8). Optional stepCache: true opts into cross-run disk step-cache (F17) when the host passes step-cache and artifacts-base (same contract as task).",
      "properties": {
        "title": { "type": "string" },
        "stepCache": { "type": "boolean", "description": "When true, allow F17 step-cache for this node if the run host enables it." },
        "transport": {
          "type": "string",
          "enum": ["stdio", "streamable_http"],
          "default": "stdio"
        },
        "toolName": { "type": "string", "minLength": 1 },
        "arguments": { "type": "object", "additionalProperties": true },
        "timeoutSec": { "type": "number", "minimum": 1, "maximum": 600, "default": 60 },
        "command": { "type": ["string", "array"] },
        "argv": { "type": "array", "items": { "type": "string" } },
        "cwd": { "type": "string" },
        "serverUrl": { "type": "string" },
        "allowInsecureLocalhost": { "type": "boolean", "default": false },
        "bearerEnvKey": { "type": "string" },
        "env": { "type": "object", "additionalProperties": { "type": "string" } },
        "envKeys": { "$ref": "#/$defs/envKeysList" }
      }
    },
    "aiRouteNodeData": {
      "type": "object",
      "additionalProperties": true,
      "description": "AI branch router node. Optional stepCache: true opts into cross-run disk step-cache (F17) when the host passes step-cache and artifacts-base (same contract as task / mcp_tool).",
      "properties": {
        "title": { "type": "string" },
        "stepCache": { "type": "boolean", "description": "When true, allow F17 step-cache for this node if the run host enables it." },
        "providerKind": {
          "type": "string",
          "enum": ["http_json"],
          "default": "http_json",
          "description": "MVP: POST JSON to endpointUrl; response must include choiceIndex (1-based)."
        },
        "endpointUrl": {
          "type": "string",
          "description": "HTTPS/HTTP URL for routing provider (POST body = ai-route request schema)."
        },
        "envVarApiKey": {
          "type": "string",
          "description": "Name of environment variable holding Bearer token (optional; omit for local/unauthenticated endpoints)."
        },
        "timeoutSec": { "type": "number", "minimum": 0.1, "default": 30 },
        "maxRetries": { "type": "integer", "minimum": 0, "default": 0 },
        "retryBackoffSec": { "type": "number", "minimum": 0, "default": 1 },
        "maxRequestJsonBytes": { "type": "integer", "minimum": 256, "default": 65536 },
        "authorHint": { "type": "string", "maxLength": 4096 },
        "onFailure": {
          "type": "string",
          "enum": ["stop_run", "fallback"],
          "default": "stop_run"
        },
        "fallbackChoiceIndex": { "type": "integer", "minimum": 1, "default": 1 }
      }
    },
    "triggerWebhookData": {
      "type": "object",
      "additionalProperties": true,
      "description": "Webhook trigger configuration. Run broker matches HTTP requests to start graph runs. See trigger_webhook node type.",
      "properties": {
        "path": {
          "type": "string",
          "minLength": 1,
          "description": "Webhook path segment (e.g. /webhook/my-hook); broker may normalize without leading slash."
        },
        "method": {
          "type": "string",
          "enum": ["GET", "POST", "PUT", "DELETE"],
          "default": "POST"
        },
        "responseMode": {
          "type": "string",
          "enum": ["immediate", "wait", "lastNode"],
          "default": "immediate",
          "description": "immediate: return run id immediately; wait (or legacy lastNode): block until run reaches a terminal status (see waitTimeoutSec), then include status/outputs/error."
        },
        "waitTimeoutSec": {
          "type": "number",
          "minimum": 1,
          "maximum": 3600,
          "default": 300,
          "description": "Seconds to wait when responseMode is wait (default 300, max 3600)."
        }
      },
      "required": ["path"]
    },
    "triggerScheduleData": {
      "type": "object",
      "additionalProperties": true,
      "description": "Schedule trigger metadata; external scheduler invokes runs. See trigger_schedule node type.",
      "properties": {
        "cron": {
          "type": "string",
          "minLength": 1,
          "description": "Cron expression (typical 5-field minute hour day month weekday)."
        },
        "timezone": {
          "type": "string",
          "default": "UTC"
        }
      },
      "required": ["cron"]
    },
    "codeData": {
      "type": "object",
      "additionalProperties": true,
      "description": "Settings for code nodes (F67): sandboxed Python or JavaScript snippet execution.",
      "properties": {
        "language": {
          "type": "string",
          "enum": ["python", "javascript"],
          "default": "python",
          "description": "Runtime language for the snippet."
        },
        "code": {
          "type": "string",
          "minLength": 1,
          "description": "Snippet source. In Python: assign `result`. In JS: assign `result`. `args` global is the parsed `arguments` value."
        },
        "arguments": {
          "description": "JSON value passed as `args` global inside the snippet.",
          "oneOf": [{ "type": "null" }, { "type": "object" }, { "type": "array" }, { "type": "string" }, { "type": "number" }, { "type": "boolean" }]
        },
        "timeoutSec": {
          "type": "number",
          "minimum": 1,
          "maximum": 600,
          "default": 30,
          "description": "Wall-clock timeout in seconds."
        },
        "memoryLimitMb": {
          "type": "integer",
          "minimum": 32,
          "maximum": 8192,
          "default": 256,
          "description": "Soft memory limit in MiB (POSIX only; ignored on Windows)."
        }
      },
      "required": ["code"]
    },
    "edge": {
      "type": "object",
      "additionalProperties": false,
      "required": ["id", "source", "target"],
      "properties": {
        "id": { "type": "string", "minLength": 1 },
        "source": { "type": "string", "minLength": 1 },
        "target": { "type": "string", "minLength": 1 },
        "data": { "$ref": "#/$defs/edgeData" },
        "sourceHandle": {
          "type": "string",
          "description": "Source handle id: out_default (success path) or out_error (failure path after task/graph_ref/mcp_tool failure; Dify FAIL_BRANCH-style). See python/README.md."
        },
        "targetHandle": { "type": "string" },
        "source_handle": { "type": "string" },
        "target_handle": { "type": "string" },
        "condition": {
          "description": "Empty/null: unconditional. Max 65536 chars after trim. Literals true/false/1/0/yes/no. Mustache templates: {{dotted.path}} or {{dotted.path}} op literal (==, !=, <, <=, >, >=); first segment may be reserved $json (last_result snapshot, n8n-style). JSON object starting with { but not {{: JSON Logic subset (same predicate root). Other strings: truthiness of last_result. See python/README.md.",
          "oneOf": [{ "type": "null" }, { "type": "string" }]
        }
      }
    }
  }
}
