{
  "schemaVersion": 1,
  "meta": {
    "schemaVersion": 1,
    "graphId": "bbbbbbbb-bbbb-4bbb-8bbb-bbbbbbbbbbbb",
    "title": "Fixture: task with gcPin",
    "author": "GraphCaster"
  },
  "viewport": { "x": 0, "y": 0, "zoom": 1 },
  "nodes": [
    {
      "id": "s1",
      "type": "start",
      "position": { "x": 0, "y": 0 },
      "data": {}
    },
    {
      "id": "t1",
      "type": "task",
      "position": { "x": 100, "y": 0 },
      "data": {
        "title": "Pinned",
        "command": ["noop-should-not-run"],
        "gcPin": {
          "enabled": true,
          "payload": {
            "processResult": { "success": true, "exitCode": 0, "stdoutTail": "ok" }
          }
        }
      }
    },
    {
      "id": "x1",
      "type": "exit",
      "position": { "x": 200, "y": 0 },
      "data": {}
    }
  ],
  "edges": [
    {
      "id": "e0",
      "source": "s1",
      "sourceHandle": "out_default",
      "target": "t1",
      "targetHandle": "in_default",
      "condition": null
    },
    {
      "id": "e1",
      "source": "t1",
      "sourceHandle": "out_default",
      "target": "x1",
      "targetHandle": "in_default",
      "condition": null
    }
  ]
}
