{
  "schemaVersion": 1,
  "meta": {
    "schemaVersion": 1,
    "graphId": "aaaaaaaa-aaaa-4aaa-8aaa-aaaaaaaaaaaa",
    "title": "handle fixture ok"
  },
  "viewport": { "x": 0, "y": 0, "zoom": 1 },
  "nodes": [
    { "id": "s1", "type": "start", "position": { "x": 0, "y": 0 }, "data": {} },
    { "id": "t1", "type": "task", "position": { "x": 100, "y": 0 }, "data": { "command": "echo" } },
    { "id": "x1", "type": "exit", "position": { "x": 200, "y": 0 }, "data": {} }
  ],
  "edges": [
    {
      "id": "e1",
      "source": "s1",
      "sourceHandle": "out_default",
      "target": "t1",
      "targetHandle": "in_default",
      "condition": null
    },
    {
      "id": "e2",
      "source": "t1",
      "sourceHandle": "out_default",
      "target": "x1",
      "targetHandle": "in_default",
      "condition": null
    }
  ]
}
