{
  "schemaVersion": 1,
  "meta": {
    "graphId": "llm-summarize",
    "title": "LLM Summarizer",
    "description": "Pass text through a native LLM node (F51) to produce a concise summary. Supports any registered provider (openai, anthropic, ollama).",
    "marketplace": {
      "badge": "Popular",
      "frameworks": ["LangChain"],
      "usecases": ["Summarization", "NLP", "LLM"],
      "author": "GraphCaster Team",
      "tags": ["llm", "summarization", "nlp", "ai"],
      "preview_image": "/static/marketplace/llm-summarize.png"
    }
  },
  "viewport": { "x": 0, "y": 0, "zoom": 1 },
  "nodes": [
    {
      "id": "s1",
      "type": "start",
      "position": { "x": 0, "y": 0 },
      "data": { "title": "Start" }
    },
    {
      "id": "llm1",
      "type": "llm",
      "position": { "x": 220, "y": 0 },
      "data": {
        "title": "Summarize",
        "provider": "openai",
        "model": "gpt-4o-mini",
        "systemPrompt": "You are a concise summarization assistant. Summarize the provided text in 2-3 sentences.",
        "userPrompt": "{{ $json.text }}",
        "temperature": 0.3,
        "maxTokens": 512,
        "stream": false
      }
    },
    {
      "id": "x1",
      "type": "exit",
      "position": { "x": 440, "y": 0 },
      "data": { "title": "Exit" }
    }
  ],
  "edges": [
    {
      "id": "e1",
      "source": "s1",
      "sourceHandle": "out_default",
      "target": "llm1",
      "targetHandle": "in_default",
      "condition": null
    },
    {
      "id": "e2",
      "source": "llm1",
      "sourceHandle": "out_default",
      "target": "x1",
      "targetHandle": "in_default",
      "condition": null
    }
  ]
}
