{
  "schemaVersion": 1,
  "meta": {
    "graphId": "cron-cleanup",
    "title": "Scheduled Cleanup",
    "description": "Daily cron trigger that removes stale temp files. Demonstrates trigger_schedule + task with a shell command.",
    "marketplace": {
      "badge": "Recommended",
      "frameworks": [],
      "usecases": ["Automation", "Maintenance"],
      "author": "GraphCaster Team",
      "tags": ["cron", "cleanup", "scheduled", "automation"],
      "preview_image": "/static/marketplace/cron-cleanup.png"
    }
  },
  "viewport": { "x": 0, "y": 0, "zoom": 1 },
  "nodes": [
    {
      "id": "s1",
      "type": "trigger_schedule",
      "position": { "x": 0, "y": 0 },
      "data": {
        "title": "Daily at midnight",
        "cron": "0 0 * * *",
        "timezone": "UTC"
      }
    },
    {
      "id": "t1",
      "type": "task",
      "position": { "x": 220, "y": 0 },
      "data": {
        "title": "Remove temp files",
        "command": "sh",
        "argv": ["sh", "-c", "rm -rf /tmp/gc-workspace-tmp/* && echo 'Cleaned up temp files'"],
        "successMode": "exit_code",
        "timeoutSec": 60
      }
    },
    {
      "id": "x1",
      "type": "exit",
      "position": { "x": 440, "y": 0 },
      "data": { "title": "Exit" }
    }
  ],
  "edges": [
    {
      "id": "e1",
      "source": "s1",
      "sourceHandle": "out_default",
      "target": "t1",
      "targetHandle": "in_default",
      "condition": null
    },
    {
      "id": "e2",
      "source": "t1",
      "sourceHandle": "out_default",
      "target": "x1",
      "targetHandle": "in_default",
      "condition": null
    }
  ]
}
