{
  "schemaVersion": 1,
  "meta": {
    "schemaVersion": 1,
    "graphId": "a1b2c3d4-e5f6-4789-a012-3456789abcde",
    "title": "Example start → task → exit",
    "author": "Aura"
  },
  "viewport": {
    "x": 0,
    "y": 0,
    "zoom": 1
  },
  "nodes": [
    {
      "id": "start1",
      "type": "start",
      "position": { "x": 120, "y": 200 },
      "data": {}
    },
    {
      "id": "t1",
      "type": "task",
      "position": { "x": 320, "y": 200 },
      "data": {
        "title": "Middle task",
        "summary": "Work step"
      }
    },
    {
      "id": "exit1",
      "type": "exit",
      "position": { "x": 520, "y": 200 },
      "data": {
        "title": "Done"
      }
    }
  ],
  "edges": [
    {
      "id": "e1",
      "source": "start1",
      "sourceHandle": "out_default",
      "target": "t1",
      "targetHandle": "in_default",
      "condition": null
    },
    {
      "id": "e2",
      "source": "t1",
      "sourceHandle": "out_default",
      "target": "exit1",
      "targetHandle": "in_default",
      "condition": null
    }
  ]
}
