{
  "schemaVersion": 1,
  "meta": {
    "schemaVersion": 1,
    "graphId": "dddddddd-dddd-4ddd-8ddd-dddddddddddd",
    "title": "fork barrier merge"
  },
  "viewport": { "x": 0, "y": 0, "zoom": 1 },
  "nodes": [
    { "id": "s1", "type": "start", "position": { "x": 0, "y": 0 }, "data": {} },
    {
      "id": "t0",
      "type": "task",
      "position": { "x": 100, "y": 0 },
      "data": { "command": "PLACEHOLDER" }
    },
    { "id": "f1", "type": "fork", "position": { "x": 200, "y": 0 }, "data": { "title": "Fork" } },
    {
      "id": "ta",
      "type": "task",
      "position": { "x": 300, "y": -80 },
      "data": { "command": "PLACEHOLDER" }
    },
    {
      "id": "tb",
      "type": "task",
      "position": { "x": 300, "y": 80 },
      "data": { "command": "PLACEHOLDER" }
    },
    {
      "id": "m1",
      "type": "merge",
      "position": { "x": 420, "y": 0 },
      "data": { "title": "Join", "mode": "barrier" }
    },
    { "id": "x1", "type": "exit", "position": { "x": 540, "y": 0 }, "data": {} }
  ],
  "edges": [
    {
      "id": "e0",
      "source": "s1",
      "sourceHandle": "out_default",
      "target": "t0",
      "targetHandle": "in_default",
      "condition": null
    },
    {
      "id": "e1",
      "source": "t0",
      "sourceHandle": "out_default",
      "target": "f1",
      "targetHandle": "in_default",
      "condition": null
    },
    {
      "id": "ef1",
      "source": "f1",
      "sourceHandle": "out_default",
      "target": "ta",
      "targetHandle": "in_default",
      "condition": null
    },
    {
      "id": "ef2",
      "source": "f1",
      "sourceHandle": "out_default",
      "target": "tb",
      "targetHandle": "in_default",
      "condition": null
    },
    {
      "id": "ema",
      "source": "ta",
      "sourceHandle": "out_default",
      "target": "m1",
      "targetHandle": "in_default",
      "condition": null
    },
    {
      "id": "emb",
      "source": "tb",
      "sourceHandle": "out_default",
      "target": "m1",
      "targetHandle": "in_default",
      "condition": null
    },
    {
      "id": "ex",
      "source": "m1",
      "sourceHandle": "out_default",
      "target": "x1",
      "targetHandle": "in_default",
      "condition": null
    }
  ]
}
